{
  "sku": "200-010-00055",
  "type": "weapons",
  "subtype": "ammunition",
  "name": "6mm Machinegun Ammunition -  4D Damage",
  "mfr": "",
  "cost": 400,
  "mass": 0.95,
  "techLevel": 6,
  "qrebs": "N/A",
  "image": "",
  "variants": [
    { "sku": "200-010-00052", "label": "1D Damage" },
    { "sku": "200-010-00053", "label": "2D Damage" },
    { "sku": "200-010-00054", "label": "3D Damage" },
    { "sku": "200-010-00055", "label": "4D Damage" },
    { "sku": "200-010-00056", "label": "5D Damage" },
    { "sku": "200-010-00057", "label": "6D Damage" },
    { "sku": "200-010-00058", "label": "7D Damage" },
    { "sku": "200-010-00059", "label": "8D Damage" },
    { "sku": "200-010-00060", "label": "9D Damage" },
    { "sku": "200-010-00061", "label": "10D Damage" }
  ],
  "description": "<p><!-- Summary Start -->Standard 6mm Machinegun round, 4D damage, 100 round box.<!-- Summary End --></p>",
  "categories": ["weapons", "ammunition"],
  "sources": [
    {
      "publication": "Traveller 5.10 Core Rules Book 3 : Worlds and Adventures",
      "authors": ["Miller, Marc W."],
      "publisher": "Far Future Enterprises"
    },
    {
      "publication": "Central Supply Catalog Website : 6mm Machinegun Ammunition -  4D Damage",
      "url": "/products/200-010-00055",
      "authors": ["Miller, Marc W.", "Eaglestone, Robert", "McKnight, Charles"],
      "publisher": "Central Supply Catalog Website"
    }
  ],
  "tags": ["products", "weapons", "ammunition"]
}
