{
  "sku": "130-001-10040",
  "type": "protections",
  "subtype": "dress",
  "name": "Combat Dress, Improved (ImCbtD-14)",
  "mfr": "",
  "cost": 176000,
  "mass": 80,
  "techLevel": 14,
  "qrebs": "N/A",
  "image": "",
  "description": "<p><!-- Summary Start -->Combat dress is intended for medium-term operations (days) against an enemy force.<!-- Summary End --></p>",
  "accessories": [],
  "categories": [
    "protections",
    "dress"
  ],
  "sources": [
    {
      "publication": "Traveller 5.10 Core Rules Book 1 : Characters and Combat",
      "authors": [
        "Miller, Marc"
      ],
      "publisher": {
        "name": "Far Future Enterprises",
        "url": "https://farfuture.net"
      }
    }
  ],
  "tags": [
    "products",
    "protections",
    "dress"
  ]
}