{
  "sku": "130-000-00039",
  "type": "protections",
  "subtype": "armor",
  "name": "Assault Armor, Small (SAA-12)",
  "mfr": "",
  "cost": 30000,
  "mass": 22,
  "techLevel": 12,
  "qrebs": "N/A",
  "image": "",
  "description": "<p><!-- Summary End -->Assault armor is a (relatively) lightweight systems is intended for short-term (hours) operations against an enemy force.<!-- Summary End --></p>",
  "accessories": [],
  "categories": ["protections", "armor"],
  "sources": [
    {
      "publication": "Traveller 5.10 Core Rules Book 1 : Characters and Combat",
      "authors": ["Miller, Marc"],
      "publisher": "Far Future Enterprises"
    }
  ],
  "tags": ["products", "protections", "armor"]
}
