{
  "sku": "180-000-00022",
  "type": "transportation",
  "subtype": "vehicles",
  "name": "Combat Tank, Wheeled (TW-W)",
  "mfr": "",
  "cost": 5420000,
  "displacement": 11,
  "techLevel": 10,
  "qrebs": "N/A",
  "image": "",
  "description": "<p><!-- Summary Start -->Standard wheeled combat tank.<!-- Summary End --></p>",
  "stats": [
    {
      "label": "Speed",
      "value": 4
    },
    {
      "label": "Load",
      "value": 0
    },
    {
      "label": "Armor",
      "value": 90
    },
    {
      "label": "Cage",
      "value": 40
    },
    {
      "label": "FlashProof",
      "value": 40
    },
    {
      "label": "RadProof",
      "value": 41
    },
    {
      "label": "SoundProof",
      "value": 53
    },
    {
      "label": "PsiShield",
      "value": 0
    },
    {
      "label": "Insulated",
      "value": 61
    },
    {
      "label": "Sealed",
      "value": 61
    }
  ],
  "categories": ["transportation", "vehicles", "military"],
  "sources": [
    {
      "publication": "Traveller 5.10 Core Rules Book 3 : Worlds and Adventures",
      "authors": ["Miller, Marc"],
      "publisher": "Far Future Enterprises"
    }
  ],
  "tags": ["products", "transportation", "vehicles", "military"]
}
