{
  "sku": "010-000-00014",
  "type": "breathing apparatus",
  "subtype": "",
  "name": "Filter (TL A)",
  "cost": 80,
  "mass": 0.1,
  "size": 3,
  "techLevel": 10,
  "qrebs": "N/A",
  "image": "",
  "description": "<p><!-- Summary Start -->The filter mask is a breathing filter which protects against taint in Air-7 and Air-9 and is effective only against T (Poison).<!-- Summary End --></p>",
  "categories": ["breathing-apparatus"],
  "sources": [
    {
      "publication": "Traveller 5.10 Core Rules Book 3 : Worlds and Adventures",
      "authors": ["Miller, Marc W."],
      "publisher": "Far Future Enterprises"
    }
  ],
  "tags": ["products", "breathing-apparatus"]
}
