{
  "sku": "130-001-10049",
  "type": "protections",
  "subtype": "dress",
  "name": "Boarding Dress, Modified (ModBdD-15)",
  "mfr": "",
  "cost": 192000,
  "mass": 43,
  "techLevel": 15,
  "qrebs": "N/A",
  "image": "",
  "description": "<p><!-- Summary Start -->Boarding dress is tailored for zero-G operations against interplanetary and interstellar vessels.<!-- Summary End --></p>",
  "accessories": [],
  "categories": [
    "protections",
    "dress"
  ],
  "sources": [
    {
      "publication": "Traveller 5.10 Core Rules Book 1 : Characters and Combat",
      "authors": [
        "Miller, Marc"
      ],
      "publisher": {
        "name": "Far Future Enterprises",
        "url": "https://farfuture.net"
      }
    }
  ],
  "tags": [
    "products",
    "protections",
    "dress"
  ]
}