{
  "sku": "130-000-00044",
  "type": "protections",
  "subtype": "armor",
  "name": "Combat Armor, Improved Vlight (ImVlCbtA-13)",
  "mfr": "",
  "cost": 176000,
  "mass": 36,
  "techLevel": 13,
  "qrebs": "N/A",
  "image": "",
  "description": "<p><!-- Summary Start -->Combat armor is intended for medium-term operations (days) against an enemy force.<!-- Summary End --></p>",
  "accessories": [],
  "categories": ["protections", "armor"],
  "sources": [
    {
      "publication": "Traveller 5.10 Core Rules Book 1 : Characters and Combat",
      "authors": ["Miller, Marc"],
      "publisher": "Far Future Enterprises"
    }
  ],
  "tags": ["products", "protections", "armor"]
}
