{
  "sku": "130-004-00023",
  "type": "protections",
  "subtype": "cyberware",
  "name": "Cybernetic Eye, Telescopic (TL-10)",
  "mfr": "",
  "cost": 10000,
  "mass": 0.06,
  "size": "0.06 liters",
  "techLevel": 10,
  "qrebs": "N/A",
  "image": "",
  "description": "<p><!-- Summary Start -->Telescopic vision allows magnification similar to telescopic binoculars, with zoom controlled by eyeball pressure (which is manipulated by squinting).<!-- Summary End --> This version of the cybernetic eye has a single-function and is easily recognizable as a mechanical implant.</p><p> In all cases, the cyber eye also includes basic visible light vision. For Sophonts with different visual ranges the basic cyber eye will cover their normal visual range.</p>",
  "categories": [
    "protections",
    "cyberware"
  ],
  "sources": [
    {
      "publication": "Traveller Wiki: Cybernetic Eyes",
      "authors": [
        "Traveller Wiki Editorial Team"
      ],
      "publisher": {
        "name": "Traveller Wiki",
        "url": "https://wiki.travellerrpg.com/Cybernetic_eyes"
      }
    },
    {
      "publication": "Fire, Fusion, & Steel",
      "authors": [
        "Chadwick, Frank",
        "Nilsen, Dave"
      ],
      "publisher": {
        "name": "Game Designers Workshop",
        "url": ""
      }
    }
  ],
  "tags": [
    "products",
    "protections",
    "cyberware"
  ]
}