{
  "sku": "040-001-00005",
  "type": "construction",
  "subtype": "construction materials",
  "name": "Wooden Planks",
  "mfr": "",
  "cost": 10000,
  "mass": 2000,
  "size": 5,
  "techLevel": 3,
  "qrebs": "N/A",
  "image": "",
  "description": "<p><!-- Summary Start -->A pallet of wooden planks.<!-- Summary End --></p>",
  "categories": ["products", "construction", "construction materials"],
  "sources": [
    {
      "publication": "Traveller 5.10 Core Rules Book 3 : Worlds and Adventures",
      "authors": ["Miller, Marc"],
      "publisher": "Far Future Enterprises"
    }
  ],
  "tags": ["products", "construction", "construction materials"]
}
