{
  "sku": "130-000-00045",
  "type": "protections",
  "subtype": "armor",
  "name": "Boarding Armor, Modified (ModBdA-13)",
  "mfr": "",
  "cost": 96000,
  "mass": 32,
  "techLevel": 13,
  "qrebs": "N/A",
  "image": "",
  "description": "<p><!-- Summary Start -->Boarding armor for use in zero-G operations against interplanetary and interstellar vessels.<!-- Summary End --> AV 28 (MgT 15)</p>",
  "accessories": [],
  "categories": ["protections", "armor"],
  "sources": [
    {
      "publication": "Traveller 5.10 Core Rules Book 1 : Characters and Combat",
      "authors": ["Miller, Marc"],
      "publisher": "Far Future Enterprises"
    }
  ],
  "tags": ["products", "protections", "armor"]
}
