{
  "sku": "160-000-00006",
  "type": "surface gear",
  "subtype": "",
  "name": "Ice Gear",
  "mfr": "",
  "cost": 100,
  "mass": 4,
  "size": 3,
  "techLevel": 7,
  "qrebs": "N/A",
  "image": "",
  "description": "<p><!-- Summary Start -->Gear for travelling through icy conditions.<!-- Summary End -->  Includes crampons: Special spiked attachments strapped to boots to assist in climbs in icy conditions. Wearing crampons decreases the difficulty of crossing ice. Also includes an ice axe, which is useful in making climbs in snow and ice.</p>",
  "categories": ["surface gear"],
  "sources": [
    {
      "publication": "Traveller 5.10 Core Rules Book 3 : Worlds and Adventures",
      "authors": ["Miller, Marc"],
      "publisher": "Far Future Enterprises"
    }
  ],
  "tags": ["products", "surface gear"]
}
