{
  "sku": "200-007-00048",
  "type": "weapons",
  "subtype": "launchers",
  "name": "Fusion Multi-Launcher, Crewed, Early (EFmLC-15)",
  "mfr": "",
  "cost": 21600,
  "mass": 39,
  "size": "",
  "techLevel": 15,
  "qrebs": "R=3",
  "damage": "Pen-4, Burn-5",
  "image": "",
  "description": "<p><!-- Summary Start -->An early-stage version of the crewed fusion multi-launcher.<!-- Summary End --></p>",
  "stats": [],
  "categories": ["weapons", "launchers"],
  "sources": [
    {
      "publication": "Traveller 5.10 Core Rules Book 3 : Worlds and Adventures",
      "authors": ["Miller, Marc"],
      "publisher": {
        "name": "Far Future Enterprises",
        "url": "https://www.farfuture.net"
      }
    },
    {
      "publication": "Traveller 5.10 Core Rules Book 3 : Worlds and Adventures",
      "authors": ["Miller, Marc"],
      "publisher": {
        "name": "Far Future Enterprises",
        "url": "https://www.farfuture.net"
      }
    }
  ],
  "tags": ["products", "weapons", "launchers"]
}
